{
  "metric": "prv",
  "unit": "ms",
  "crew": "W1",
  "points": [
    {
      "t": 1759988400.0,
      "mean": 44.0,
      "min": 39.0,
      "max": 51.0
    },
    {
      "t": 1759992000.0,
      "mean": 43.0,
      "min": 38.0,
      "max": 50.0
    },
    {
      "t": 1759995600.0,
      "mean": 42.0,
      "min": 37.0,
      "max": 49.0
    },
    {
      "t": 1759999200.0,
      "mean": 41.0,
      "min": 36.0,
      "max": 48.0
    },
    {
      "t": 1760002800.0,
      "mean": 40.0,
      "min": 35.0,
      "max": 47.0
    },
    {
      "t": 1760006400.0,
      "mean": 39.0,
      "min": 34.0,
      "max": 46.0
    },
    {
      "t": 1760010000.0,
      "mean": 38.0,
      "min": 33.0,
      "max": 45.0
    }
  ],
  "baseline": [
    {
      "t": 1759988400.0,
      "mean": 45.0,
      "lo": 38.0,
      "hi": 52.0
    },
    {
      "t": 1759992000.0,
      "mean": 45.0,
      "lo": 38.0,
      "hi": 52.0
    },
    {
      "t": 1759995600.0,
      "mean": 45.0,
      "lo": 38.0,
      "hi": 52.0
    },
    {
      "t": 1759999200.0,
      "mean": 45.0,
      "lo": 38.0,
      "hi": 52.0
    },
    {
      "t": 1760002800.0,
      "mean": 45.0,
      "lo": 38.0,
      "hi": 52.0
    },
    {
      "t": 1760006400.0,
      "mean": 45.0,
      "lo": 38.0,
      "hi": 52.0
    },
    {
      "t": 1760010000.0,
      "mean": 45.0,
      "lo": 38.0,
      "hi": 52.0
    }
  ],
  "cusum": [
    {
      "t": 1759988400.0,
      "pos": 0.0,
      "neg": 0.0,
      "h": 5.0
    },
    {
      "t": 1759992000.0,
      "pos": 0.4,
      "neg": 0.0,
      "h": 5.0
    },
    {
      "t": 1759995600.0,
      "pos": 0.8,
      "neg": 0.0,
      "h": 5.0
    },
    {
      "t": 1759999200.0,
      "pos": 1.2000000000000002,
      "neg": 0.0,
      "h": 5.0
    },
    {
      "t": 1760002800.0,
      "pos": 1.6,
      "neg": 0.0,
      "h": 5.0
    },
    {
      "t": 1760006400.0,
      "pos": 2.0,
      "neg": 0.0,
      "h": 5.0
    },
    {
      "t": 1760010000.0,
      "pos": 2.4000000000000004,
      "neg": 0.0,
      "h": 5.0
    }
  ],
  "limits": {
    "yellow": null,
    "red": null
  }
}
